key	verdict	locus	note
word-structure-overview:25	SILENT	—	Искал: dhātu, aṅga, «четыре способа», samāsa как схема — послойной модели и этих терминов нет; материал дан без такой рамки.
word-structure-overview:30	SILENT	—	Утверждение о тексте Уитни; в конспекте Уитни нигде не цитируется (единственная внешняя отсылка — Кочергина, L623).
word-structure-overview:83	SILENT	—	Искал: bhvādi, класс 1, проценты/преобладание — классы указаны при корнях (L448), но статистики долей и тезиса о преобладании нет.
word-structure-overview:28	AGREE	раздел «Словообразование» (L405–409)	Термина kṛt нет, но суть дана: от корня — «Имена действия: g‑a‑ (m) … g‑ana‑ (n) … ø‑ti‑», имена деятеля/орудия, прич. (L395), дееприч. (L399).
krt-overview:19	AGREE	раздел «Словообразование» (L407)	«g‑tar‑ (или ‑itar‑) --- janitar‑ 'родитель', dātar‑»; ср. ø‑tvā (kṛtvā), g‑tum (kartum), g‑aka‑ (bodhaka‑); термин kṛt не употребляется.
krt-overview:34	SILENT	—	Ссылка на текст Уитни; конспект Уитни не цитирует (искал: Уитни, Whitney, §§).
krt-overview:61	AGREE	раздел «Перфект» (L399)	«без преверба ø‑tvā (или ‑itvā), с превербом ø‑ya».
krt-overview:62	AGREE	раздел «Перфект» (L401)	«Герундивы: g‑tavya‑ (или ‑itavya‑), g‑anīya‑, v/g‑ya‑».
krt-overview:63	AGREE	раздел «Перфект» (L393)	«Инфинитив: g‑tum (или ‑itum) --- dātum, chettum, bhavitum».
krt-overview:67	SILENT	—	О разметке DCS (тег времени); сами причастия на ‑ta/‑na у З. есть (L395), корпусных категорий нет.
krt-suffixes:14	SILENT	—	Утверждение о §§ Уитни; У. не цитируется; сами суффиксы (g‑a, g‑ana, ø‑ti, g‑tar, g‑in) есть в «Словообразовании» (L405–407).
krt-suffixes:96	AGREE	раздел «Словообразование» (L407, 424)	Девербатив «g‑in‑ … vādin‑ 'говорящий'» и отыменное «balin‑ 'сильный' от bala‑» даны как разные образования; ‑vin и проблема ‑in$ отсутствуют.
krt-suffixes:155	SILENT	—	Искал: jana, членение ‑a/‑ana — не обсуждается; g‑a‑ и g‑ana‑ даны как отдельные суффиксы (L405), от JAN приведено лишь janman‑.
krt-suffixes:147	AGREE	раздел «Словообразование» (L405)	«ø‑ti‑ (f) --- pluti‑» + слабая ступень ряда M₁ = a (L56): gam→ga‑ti; сама форма gati не цитируется, но следует из правил.
taddhita-overview:19	AGREE	раздел «Словообразование» (L423–428)	«Отыменные прилагательные», «Патронимы (всегда с vṛddhi первого слога)», «amṛtatva‑ 'бессмертие'» — вторичная деривация от именных основ; термина taddhita и ‑maya нет.
taddhita-overview:200	AGREE	раздел «Словообразование» (L423–432)	«‑a‑, ‑ya‑, ‑eya‑, ‑īya‑, ‑ka‑, ‑aka‑, ‑ika‑, ‑in‑, ‑vant‑, ‑mant‑» + ‑tā/‑tva (L428), ‑tara/‑tama (L430), уменьш. ‑ka (L432); ‑maya и ‑vin отсутствуют.
taddhita-overview:205	AGREE	раздел «Словообразование» (L424–428)	‑ya в трёх функциях: daivya‑ (относит.), «Патронимы … ‑ya‑» с vṛddhi, «vaidhavya‑ 'вдовство'» (отвлеч.); Уитни не цитируется.
taddhita-overview:144	AGREE	раздел «Словообразование» (L407, L423)	Оба -in в инвентаре: «g‑in‑ … vādin‑ 'говорящий'» (kṛt) и «balin‑ 'сильный' от bala‑» (L424); оба -ya: герундив kārya (L401), daivya/патронимы (L423, L426). Сама омонимия не комментируется.
preverbs:19	AGREE	раздел «Превербы» (L452)	Список превербов с их значениями: «Ā к, сюда, при‑; UD вверх, наружу, вз‑, вы‑»; термина upasarga нет, «радикальность» сдвига не обсуждается.
preverbs:99	SILENT	—	Утверждение о тексте Уитни; З. Уитни не цитирует. Сам он даёт 19 превербов, включая antar (L452), а su/dus относит к именным префиксам (L454).
preverbs:104	AGREE	раздел «Особенности ведийского языка» (L551)	О тмесисе: «свободно располагаются до или после глагола… в отдалении от него»; стопка sam+ā и лексикализация прямо не разобраны.
compounds-overview:24	AGREE	раздел «Словообразование» (L436)	«синтаксически равные последнему члену» — вершина справа; двандва даны сочинительными парами «хлеб-соль, отец-мать». У З. dvandva формально тоже среди «первичных».
compounds-overview:29	SILENT	—	У З. своя четвёрка tp/karmadhāraya/dvandva/bahuvrīhi (L436) без dvigu, avyayībhāva и иерархии вложения; паниниевскую систематику/Лейтана не трактует. Искал: dvigu, avyayī.
tatpurusha:14	SILENT	—	Паниниевской таксономии нет: ни pradhāna, ни avyayībhāva, ни kevala-samāsa; лишь практический список типов (L436). Искал: pradhāna, avyayī.
tatpurusha:191	SILENT	—	Утверждение о кодовой книге/реестре разметки, не о языке; З. классификацию Лейтана и dvigu не обсуждает. Искал: dvigu, Лейтан.
tatpurusha:92	AGREE	раздел «Словообразование» (L436)	Эндо/экзо через первичные/вторичные: «Вторичные (прилагательные со значением „имеющий то, что названо“)»; невыводимость из членения не обсуждается.
tatpurusha:179	SILENT	—	Рекурсивного членения многочленных композитов нет; лишь «почти нет трехчастных» о ведах (L489). Искал: трехчастн, справа налево.
tatpurusha:162	SILENT	—	upapada-композитов с kṛt-вершиной нет. Искал: upapada, ‑jit, корневые вершины композитов.
bahuvrihi:19	AGREE	раздел «Словообразование» (L436)	«прилагательные со значением „имеющий то, что названо“» — посессивность и внешний референт против «первичных» (= последнему члену); эпоним bahu-vrīhi не разобран.
bahuvrihi:58	SILENT	—	Двусмысленность одной цепочки членов (tp vs bv) не обсуждается. Искал: mahā-bāhu, омонимия композитов.
bahuvrihi:106	AGREE	раздел «Словообразование» (L440)	«аналоги bahuvrīhi — напр. a‑hasta 'безрукий'» + SA‑ «снабженный (чем)» (L454); терминов samānādhikaraṇa/vyadhikaraṇa и числового подтипа нет.
bahuvrihi:84	SILENT	—	Теста-виграхи внешним относительным оборотом нет. Искал: yasya, виграха/парафраза.
case-system-overview:19	AGREE	раздел «Склонение» (L182–223)	Таблица склонения даёт ровно 8 рядов: «N, Voc, A, I, D, Abl, G, L»; термин vibhakti не используется.
case-system-overview:51	SILENT	—	В конспекте вообще нет синтаксиса/функций падежей (только формы). Искал: подлежащее, орудие, обращение.
case-system-overview:66	SILENT	—	Функций падежей нет; сдвиг датив→генитив не обсуждается. Искал: адресат, генитив.
case-system-overview:68	SILENT	—	Функций датива нет; artha‑ лишь в списке существительных 'цель, вещь' (L476), не -artham 'ради'. Искал: artham, ради.
case-system-overview:70	AGREE	раздел «Словообразование» (L438)	«все члены, кроме последнего, представлены чистой основой» — падежное окончание несёт только последний член.
case-system-overview:92	AGREE	раздел «Склонение» (L182–196)	a-основы sg: N ‑s, A ‑am, I «E‑N‑A», D «āyA», Abl «ĀD», G «a‑SYA», L e, Voc ‑Ø; аблатив у З. записан ‑ād (=‑āt).
case-system-overview:98	SILENT	—	Синтаксиса падежей нет; пассив описан только морфологически. Искал: орудие, агенс.
case-system-overview:100	SILENT	—	Функций аблатива нет. Искал: сравнение, Гималаи/чем.
case-system-overview:101	SILENT	—	Функций локатива и абсолютных оборотов нет. Искал: абсолют, gate rāme.
case-system-overview:102	SILENT	—	Карак и падежной теории Панини нет. Искал: kāraka/карака, Панини.
case-system-overview:113	AGREE	раздел «Склонение» (L212, L218)	Строки «sg NVocA n»/«pl NVocA n» (Nom=Acc среднего) и «du NVocA + ‑au», у ā-основ du «E» (=‑e).
nominative-accusative:52	SILENT	—	Синтаксиса падежей нет. Искал: подлежащее, предикатив.
nominative-accusative:57	SILENT	—	Локатива абсолютного и не-номинативных подлежащих нет. Искал: абсолют, sati.
nominative-accusative:61	SILENT	—	Именного сказуемого при связке нет (связка as лишь в футуруме 2, L383). Искал: сказуемое, связка.
nominative-accusative:79	SILENT	—	Синтаксиса аккузатива нет; лишь словообразовательное «Наречия: = Asg n прилагательного» (L434). Искал: цель движения, длительность.
nominative-accusative:88	SILENT	—	Двойного аккузатива нет. Искал: yāc/просить, двойной.
nominative-accusative:113	SILENT	—	Туземных имён падежей нет. Искал: prathamā, dvitīyā, vibhakti.
nominative-accusative:116	SILENT	—	Двойного аккузатива нет (DUH 'доить' лишь в списке корней, L448). Искал: dogdhi, учить.
instrumental-dative:50	SILENT	—	Карак и функций творительного нет. Искал: karaṇa, орудие.
instrumental-dative:53	SILENT	—	Падеж деятеля при пассиве не указан; пассив только формально (L389). Искал: mayā kṛtam, деятель.
instrumental-dative:57	SILENT	—	Функций творительного нет; SAHA 'с' лишь в списке предлогов без указания падежа (L456). Искал: социатив, совместность.
instrumental-dative:66	SILENT	—	Сдвига адресата датив→генитив нет. Искал: адресат, генитив.
instrumental-dative:76	SILENT	—	Датива цели и -artham нет. Искал: artham, ради.
instrumental-dative:97	SILENT	—	Функций творительного нет. Искал: цена, мера, образ действия.
instrumental-dative:99	SILENT	—	Карак и sampradāna нет. Искал: sampradāna, адресат.
instrumental-dative:101	SILENT	—	Лишь «В ведах есть и другие [инфинитивы]» (L393) и вариативные «типы инфинитива» (L491); ‑tave и дативность не названы. Искал: tave, датив.
ablative-genitive:53	SILENT	—	Функций аблатива нет. Искал: apādāna, источник.
ablative-genitive:69	SILENT	—	Функций генитива нет. Искал: принадлежность, посессив.
ablative-genitive:72	SILENT	—	Сдвига роли адресата к генитиву нет. Искал: адресат, датив.
ablative-genitive:75	SILENT	—	Генитивного объекта при глаголе нет. Искал: партитив, объект.
ablative-genitive:134	SILENT	—	Генитива абсолютного нет. Искал: абсолют, paśyato.
ablative-genitive:136	SILENT	—	Ни генитива, ни локатива абсолютного нет. Искал: абсолют, стилистически.
ablative-genitive:131	SILENT	—	Управления предлогов нет; в списке лишь SAHA/VINĀ/UPARI (L456), ṛte отсутствует, ā только преверб 'к, сюда' (L452). Искал: ṛte, до.
ablative-genitive:132	SILENT	—	Функций генитива (śeṣa) нет. Искал: śeṣa, часть-целое.
locative:56	SILENT	—	Функций локатива нет. Искал: adhikaraṇa, место/время.
locative:22	SILENT	—	Локатива абсолютного нет. Искал: sati saptamī, абсолют.
locative:123	SILENT	—	Локатива абсолютного нет; «Деепричастие» у З. — герундий на ‑tvā/‑ya (L399), не абсолютив. Искал: gate rāme, sati.
karaka-case:24	SILENT	—	Модели карак нет. Искал: kartṛ, karman, kāraka.
karaka-case:99	SILENT	—	Соотношения падеж↔роль нет. Искал: агенс, роль.
karaka-case:146	SILENT	—	Утверждение о тексте Уитни; З. Уитни не цитирует. Искал: Уитни, вибхакти.
karaka-case:162	SILENT	—	Синтаксиса пассивной клаузы нет; пассив только морфологически (L389). Искал: karman, подлежащее.
voice:23	AGREE	раздел «Перфект» (L389)	«Пассив (только система презенса): ø‑ya‑…; спрягается в Med.»; наборы Act/Med — по всей таблице спряжения (L270–294); терминов parasmai-/ātmanepada нет.
voice:69	SILENT	—	Падеж агенса пассива не назван. Искал: инструменталис, деятель.
voice:128	AGREE	раздел «Спряжение» (L276)	Два набора окончаний в таблице: «‑ti … ‑te», «‑anti … ‑ate»; лексичность выбора пады и семантика медия («в свою пользу») не обсуждаются.
voice:131	AGREE	раздел «Перфект» (L389)	«Пассив (только система презенса): ø‑ya‑…; спрягается в Med.» — чистое совпадение; вне презенса ср. прич. ‑ta «обычно страдат. у переходных» (L395).
HK-1	SILENT	—	Типы аориста описаны (L339–353), но об образовании лишь от части корней и редкости в санскрите — нет; «прочие крайне редки» — о типах. Искал: аорист, редк-, полов-.
HK-2	SILENT	—	Лишь список частиц «-нибудь, -то»: CIT, SVIT, CANA, API (L460); о склонении только вопросительной части и внешних сандхи — нет. Искал: неопредел-, частицы, cana/cit.
HK-3	AGREE	раздел «Перфект» (L401)	Герундивы: «g-tavya- (или -itavya-), g-anīya-, v/g-ya-»; глоссы тождественны: dātavya- и deya- 'подлежащий отдаче'.
HK-4a	AGREE	раздел «Перфект» (L379)	«Футурум: g-sya- (или -iṣya-), окончания первичные» — одно правило для всех; квантор «от всех» отдельно не обсуждён.
HK-4b	DISAGREE	раздел «Перфект» (L379)	Выбор -iṣya- у З. лексичен: вставное i — ряды U2/R2/M2/N2 и seṭ-корни, «много колебаний и непоследовательностей» (L72), а не «после дифтонгов и -ar»; s→ṣ — общее сандхи (L129).
HK-5	SILENT	—	Тип есть («строится как имперфект класса 6», L343), но о наибольшей распространённости и корнях на согласную — нет. Искал: тематический, распростран-.
HK-6	AGREE	раздел «Спряжение» (L298)	Причастия Med.: «-āna- ‖ -māna-», f «-ānā- ‖ -mānā-» — основы на -a (m/n) и на -ā (f); пассив спрягается в Med. (L389).
HK-7	SILENT	—	Частотность гласных не обсуждается; лишь диахрония *e/*o/*a → a (L10). Искал: преоблад-, систем- гласных.
HK-8	SILENT	—	Частотность ṝ, ḷ, ḹ не обсуждается; ḷ лишь в скобках в таблице чередований (L54). Искал: редк-, ряды L/R.
HK-9	AGREE	раздел «Морфонология» (L105)	«k, ṭ, t, p озвончаются перед всяким звуком, кроме глухих согласных» — покрывает звонкие шумные, y/r/v, гласные; перед j/jh/ḍ/ḍh, носовыми, h — особые правила (L101–103).
HK-10	DISAGREE	раздел «Сведения об акцентуации» (L621)	Глагол «имеют ударение… б) в придаточном предложении, в)… после другой личной формы» — и в середине фразы бывает ударен; об ударении частиц молчит.
HK-11	AGREE	раздел «Морфонология» (L117)	«перед гласными и звонкими согласными (кроме r) → r»; «Исключение составляют только as и ās» (L119) — т.е. не после ā̆.
HK-12	SILENT	—	Частотность a-основ не обсуждается. Искал: большинств-, распростран-.
HK-13	AGREE	раздел «Склонение» (L218)	В таблице единые строки «sg NVocA n», «pl NVocA n», «du NVocA n» — N и A (и Voc) среднего рода совпадают во всех числах.
HK-14	AGREE	раздел «Некоторые существительные» (L476)	«слова без помет: на ā, ī --- жен. рода»; женские окончания обязательны в ā-склонении (L167). Особый тип — корневые ā (jās m, L226).
HK-15	SILENT	—	Только образование имперфекта (L335); об употреблении как времени повествования — нет. Искал: повествован-, прошл-.
HK-16	AGREE	раздел «Склонение» (L167)	«Специфически женские» окончания «обязательны в ā-, ī-, ū-склонениях»; образцы devī, vadhū (L226) — ж.р.
HK-17	SILENT	—	Частотность форм императива не обсуждается. Искал: императив, часто/чаще.
HK-18	AGREE	раздел «Спряжение» (L257)	«в тематическом спряжении тематическое а удлиняется в ā» — знак ∼ при всех окончаниях 1-го лица (L270–289); о доле тематических глаголов молчит.
HK-19	SILENT	—	Правила о структуре корней IX класса нет; только пример «badh-nā-mi» от BANDH с утратой носового (L328). Искал: IX/9 класс, носов-.
HK-20	AGREE	раздел «Спряжение» (L265)	3 pl «-ati*» вместо -anti: «при редуплицированной атематич. основе презенса (класс 3)»; пример «dad-ati 'дают'» (L314).
HK-21	AGREE	раздел «Морфонология» (L129)	«с, ç, ṣ, ch, j (любое), h (любое) + s → kṣ»; там же «неконечное s → ṣ» после k, r, гласных кроме a/ā. У З. без оговорки «чаще всего» для j, h.
HK-22	AGREE	раздел «Склонение» (L182)	N.sg: «-s; [ā, ī, ar, an] -Ø», в колонке ar — «Ā»: основы на -ar дают -ā без r (dātā, pitā).
HK-23	SILENT	—	Кондиционалис только формально («по форме это имперфект футурума», L381); о редкости употребления — нет. Искал: кондиционалис, редк-.
HK-24	AGREE	раздел «Перфект» (L359)	Согласная удвоит. слога «равна первой согласной корня, но с потерей придыхательности».
HK-25	DISAGREE	раздел «Перфект» (L391)	Описательный перфект «заменяет простой перфект… у корней со сложным сочетанием согласных» — значит не от всех односложных корней на согласную.
HK-26	AGREE	раздел «Перфект» (L369)	Парадигмы дают ровно это: с -i- «yuyojitha», «yuyujima», «dadima», «teniṣe»; kar без i: «cakartha», «cakṛma», «cakṛṣe».
HK-27	SILENT	—	Синтаксис пассивной конструкции (агенс в I., согласование с объектом) не описан — только образование (L389). Искал: агенс, творительн-/Instrumentalis.
HK-28	SILENT	—	О пассиве непереходных и обязательном 3 sg — нет; лишь безличное «ucyate… 'говорят (on dit)'» (L389). Искал: непереходн-, безличн-.
HK-29	AGREE	раздел «Перфект» (L395)	Претеритное причастие: «ø-ta- (или -ita-)», у части корней «ø-na-» (ø = слабая ступень; -na- у d-корней aniṭ и R2 — реже). Ударение не обсуждает.
HK-30	AGREE	раздел «Склонение» (L241)	«sarva-… --- как ya-, но Nsg n не на -d, а на -m» (в n N=A) — прономинальный тип с адъективным sarvam.
HK-31	AGREE	раздел «Морфонология» (L125)	«На конце слова в сочетании согласных все элементы, кроме первого, отпадают (напр. -nts → -n)».
HK-32	AGREE	раздел «Некоторые существительные» (L476)	«слова без помет:… на as, is, us --- сред. рода» — средний род как дефолт; исключения помечены (uṣas f, mās m).
HK-33	AGREE	раздел «Склонение» (L253)	«tri-, (f tis̥-)» (L249); tri/tisṛ «по общим моделям… i-, r-склонения»; pañca — одна парадигма без различия рода: «NVocA pañca, I pañcabhis».
HK-34	SILENT	—	О роде сложных слов прямо не сказано; лишь «синтаксически равные последнему члену» о первичных (L436). Искал: род, bahuvrīhi/tatpuruṣa.
HK-35	SILENT	—	Dvandva лишь типологически («как хлеб-соль», L436); о мн. числе последней основы при 3+ членах — нет. Искал: dvandva, множеств-.
HK-36	SILENT	—	Каузатив — только образование (L413); о всеобщей переходности и неполном охвате корней — нет. Искал: переходн-, каузатив.
