key	verdict	locus	note
a-stems:14	AGREE	урок II (L285)	Полная парадигма deva/phala: 8 падежных форм (с Voc.) × 3 числа — «devaḥ, devau, devāḥ»; о частотности склонения на -a источник молчит.
a-stems:17	SILENT	—	Voc. — отдельная строка парадигм, статус падежа не обсуждается; искал «звательн», «Vocativ», «падеж».
a-stems:169	SILENT	—	Правило прилагательных на a есть (урок IX), о величине класса ничего; искал «прилагательн», «класс».
a-stems:172	AGREE	урок IX (L1183)	«Прилагательные на a (муж. и ср. р.), ж. р. ā» — три родовые парадигмы (deva/phala/jāyā); в словнике и ж. р. на ī (sundara f ī); 72 клетки — арифметика статьи.
a-stems:179	AGREE	урок III (L424)	Таблицы дают одну форму на слитые клетки: «devebhyaḥ (s)» покрывает D и Abl pl; jāyayoḥ — G/L du (урок IX, L1179); дуальные D/I/Abl слиты в одну клетку.
a-stems:202	SILENT	—	Ведийские варианты окончаний не упоминаются; искал devāsas, devebhis, «ведийск».
declension-overview:20	AGREE	урок IX (L1183)	«склоняются в муж. р. как deva, в ср. р. как phala и в ж. р. как jāyā»; парадигмы из 8 падежных строк × 3 числа (напр. aham: N.V., Acc, I, D, Abl, G, L).
declension-overview:22	AGREE	урок XX (L2583)	Склонение подано по исходу основы (на a, ā, i, u, ū, ṛ, o, au, согласный): «принимают те же окончания, что и nau».
declension-overview:86	AGREE	урок XXVI (L3475)	«I.sg. jarayā или jarasā; pādena или padā» — контраст -ena/-ayā/-ā; также vācā, rājñā, manasā; I-строки ряда ранних таблиц в файле утрачены.
consonant-stems:19	SILENT	—	Ранжирования «второй по важности» нет — согласные основы просто вводятся после гласных; искал «важн», «главн».
consonant-stems:22	AGREE	урок XXIV (L3135)	«В слабых пад. n отпадает перед консонантическими окончаниями» — rājabhiḥ, rājasu; V.sg. rājan/śrīman — краткая основа; термина «средняя ступень» нет.
consonant-stems:23	AGREE	урок XXIV (L3135)	«В N. sg. n всегда отпадает» (rājā); парадигма: rājānam (сильн.), rājñā (слаб.), rājabhyām/rājasu (перед согласными).
consonant-stems:30	AGREE	урок XXII (L2891)	«удлиняют i и отбрасывают n» в N.sg. (dhanī) и «перед окончаниями начинающимися с согласного»; перед гласными n сохраняется (dhaninam).
consonant-stems:31	AGREE	урок XXII (L2912)	«Сущ. ср. р. на as, is и us»; «в N. V. Асс. pl. получается āṅsi» — manāṅsi; м./ж. на as — вторичный подтип (sumanas, L2942).
consonant-stems:33	AGREE	урок XXI (L2717)	Корневые vāc, ruj, diś: окончания прямо к корню — «vācam... vācā... vāgbhyām»; vat/vas/añc — особые двухосновные классы (уроки XXIII–XXV).
consonant-stems:98	AGREE	урок XX (L2591)	«В сильных падежах, N. Асc.sg. m., N. V. Acc. du. m, N. V. pl. m»; слабые rājñā, rājñaḥ, rājñi; средние rājabhyām, rājabhiḥ, rājasu (L3149–3151).
pronouns:19	SILENT	—	Списки и парадигмы местоимений даны, тезиса о закрытом непополняемом классе нет; искал «местоимен», «класс».
pronouns:22	AGREE	урок XIX (L2450)	«Основы --- mad, asmad» (aham), «tvad, yuṣmad» (tvam); «Местоимение третьего лица tad он, она, оно; тот» — роль 3 л. играет tad.
pronouns:25	AGREE	урок XIX (L2450)	tad «тот», etad «этот» (L2473); «idam этот» (L3543), «adas тот» (L3568, урок XXVII) — весь ряд в наличии.
pronouns:26	AGREE	урок XIX (L2493)	«kim образует N. sg. kaḥ, kā, kim», Acc. kam/kām/kim, далее следует tad.
pronouns:27	AGREE	урок XIX (L2475)	«yad который: yaḥ, yā, yat» — в списке склоняемых как tad.
pronouns:28	AGREE	урок XIX (L2561)	«kas, kā+cit, +cana или +api - кто-нибудь, некто»; kim+cit/cana/api — вопросительное + частица.
pronouns:29	AGREE	урок XIX (L2489)	sarva и др. «склоняются как tad»; anya — как tad (L2477), para/pūrva — как sarva (L2499); sama не упомянут; в Abl.L.sg. и N.pl. допустим и тип deva.
pronouns:32	AGREE	урок XIX (L2463)	Парадигма tad: «tasmai... tasmāt... tasmin... teṣām» — особый местоименный образец; уникальность окончаний прямо не тематизирована.
pronouns:90	AGREE	урок XVIII (L2334)	aham: «mahyam, me», «mama, me», «asmākam, naḥ»; tad: saḥ/sā (без t-), tasmai, tasmāt, tasmin, teṣām (L2458–2469).
thematic-present:14	AGREE	урок I (L129)	«Корни по этому делятся на десять классов»; четвёрка на a: «С конечным a основы наст. вр. I, IV, VI и X классов» (L2071); vadati, lubhyati, tudati, X на aya.
thematic-present:129	AGREE	урок III (L415)	VI кл. «вставляют a, но их гласные не заменяются... guṇa», I кл. — с guṇa (урок II); об акценте и совпадении без него источник молчит.
thematic-present:134	SILENT	—	IV кл. ya (урок V, L652) и пассивное ya (урок X, L1301) даны порознь; совпадение форм и акцент не обсуждаются; искал «IV кл», «страдательн».
thematic-present:150	AGREE	урок XXXV (L4901)	V: «сильн. no [ṇo], слаб. nu»; VIII o/u (L5095); IX «nā [ṇā]» (L5241); VII «вставляют na [ṇa], в слабых n» (L6183); III — удвоение (L6003); IV — ya (L652).
thematic-present:92	AGREE	урок XVIII (L2300)	Каузатив на paya/aya «спрягается точно так как глаголы Х кл.»; X кл. — в группе основ на a (L2071); отыменные — урок XLVIII.
thematic-present:94	SILENT	—	Утверждение о списках Уитни; у Бюлера kṛ приписан только VIII кл. (L5097), многоклассность корней не обсуждается.
thematic-present:186	AGREE	урок V (L699)	«as IV - бросать, метать» против «Корень as II. Р. Ā., быть» (урок XL, L5867) — оба омонима с разными классами.
conjugation-overview:25	AGREE	урок I (L116)	«десять времен и наклонений... три числа... для трех лиц»; каждая форма в parasmaipada и ātmanepada — все оси заявлены.
conjugation-overview:26	AGREE	урок I (L118)	В списке 10 форм: indicativus (наст.), imperfectum, «perfectum», «аорист», «простое будущее», «описательное будущее»; склейка прошедших в DCS — вне источника.
conjugation-overview:27	AGREE	урок I (L118)	В списке: imperativus, optativus, «conditionalis», «precativus (benedictivus)»; субъюнктив/инъюнктив не трактуются (лишь mā + безаугментный аорист, L7007).
conjugation-overview:28	AGREE	урок I (L116)	Активная (parasmaipada) и медиальная (ātmanepada) формы; «Страдательный залог образуется при помощи суффикса ya» (урок X, L1301).
imperfect:19	AGREE	урок XI (L1417)	От основы наст. вр. + вторичные окончания: «Перед глаголом появляется приращение a»; ajaya, avadat.
imperfect:21	AGREE	урок XI (L1439)	«Imperfectum выражает прошедшее время и употребляется в историческом рассказе».
imperfect:76	AGREE	урок XI (L1419)	При слиянии приращения с начальным гласным «получается соответствующий двугласный vṛddhi»; āsīt — в парадигме as (L5897).
imperfect:77	AGREE	урок XI (L1431)	Парадигма: «a-vad-a-m, a-vad-a-ḥ, a-vad-a-t»; -va, -tam, -tām; -ma, -ta, -an — весь набор совпадает.
imperfect:78	AGREE	урок XXXVI (L5127)	«akarot» (основа karo-, L5097); bhava- (урок II), bravī- (L5551); abhavat/abravīt в файле не напечатаны, но прямо следуют из правила урока XI.
imperative-optative:19	AGREE	урок I (L129)	«Первые четыре производятся от особой основы настоящего времени» — ind., impf., imperativus, optativus; прекатив/кондиционал — периферия в конце курса.
imperative-optative:89	AGREE	урок XIV (L1801)	vada, vadatu, vadata; «оканчивается на dhi, после гласных его заменяет hi или оно отпадает» (L4897); «2-е и 3-е лицо... выражают приказание» (L1859).
imperative-optative:92	AGREE	урок XVI (L2071)	«оптативный ī сливается в e» (vadet) + окончания имперфекта; атематически «при помощи yā» (L4899): sunuyāt, syām (L5917).
imperative-optative:93	AGREE	урок XVI (L2085)	«Optativus обыкновенно выражает возможность, желание или приказание»; шастровое «следует» отдельно не выделено.
imperative-optative:57	AGREE	урок XIV (L1859)	«Второе и третье лицо императива большей частью выражают приказание» — юссивное 3 л.; astu в парадигме as (L5913), глосса «пусть» не даётся.
perfect:14	AGREE	урок XLIII (L6379)	«А. Перфект с удвоением»; описательный перфект обязателен для тяжёлых начал и «всех корней X кл, всех каузативов» (L6673): «суффикс ām» + āsa/cakāra/babhūva.
perfect:16	SILENT	—	Утверждение о тексте Уитни; у Бюлера veda — лишь альтернативный индикатив vid II (L5707), перфектом не назван; искал veda, viveda, vid.
perfect:105	AGREE	урок XLV (L6937)	Перфект образуется удвоением без приращения (урок XLIII), а «Третий аорист --- по форме есть imperf. с удвоением»: аугментированная редуплицированная форма — аорист.
perfect:100	AGREE	урок XLV (L6943)	III аорист: аугмент + удвоение, «образуется от корней X кл. и каузативов»; «pat Р., apaptat»; самих ajījanat/avīvṛdhan нет (ср. ajagaṇat, avīvṛtat).
perfect:101	SILENT	—	adadat не рассматривается: dā даёт adāt (I тип) и adita (IV Ā., L7083), adadhat — от dhe «сосать» (L6941); искал adadat, dadā.
perfect:118	AGREE	урок XLIII (L6677)	«в Par. āsa, cakāra или babhūva, в Ātm. cakre» — тройка as/kṛ/bhū; частотная иерархия и §§ Уитни не обсуждаются.
perfect:124	AGREE	урок XLIII (L6673)	Описательный перфект «обязателен» для «всех корней X кл, всех каузативов... и отыменных глаголов» — т.е. производных основ на aya.
perfect:134	AGREE	урок XLI (L6003)	III кл.: «личные окончания прямо к корню, причем в корне происходит удвоение»; bibharti (L6029), juhoti (L6125); dadāti в файле не встретился.
aorist:19	AGREE	урок XLV (L6907)	Семь нумерованных аористов (I–VII, уроки XLV–XLVII); употребляются как «редких форм прошедшего времени, совершенно равноправно с perf. и imperf.» (L7007).
aorist:84	AGREE	урок XLV (L6909)	I abhūt; II agamat, «vac Р., avocat»; III редуплиц. (X кл./каузативы); IV akārṣīt; V alāvīt (i/ī); VI ayāsīt (siṣ); VII adikṣat (sa) — все с аугментом.
aorist:108	AGREE	урок XLV (L6937)	«Третий аорист --- по форме есть imperf. с удвоением»; II «образуется также как impf.» тематич. класса, VII «спрягается подобно impf. I кл.» (L7133).
aorist-types:19	AGREE	урок XLV (L6907)	Аорист дан семью параллельными образованиями («Первый аорист»... «Седьмой аорист»), тогда как imperf. и perf. — по одному способу.
aorist-types:61	AGREE	урок XLV–XLVI (L6907, L7013)	Сам делит так же: «Корневые аористы» (I–III: root/them/red) против «образованные при помощи суффиксов (сигматические)» (IV s, V iṣ, VI siṣ, VII sa); Уитни не назван.
aorist-types:89	AGREE	урок XLV–XLVII (L6909–L7133)	Все типы: abhūt, avocat, III «по форме есть imperf. с удвоением» (от каузативов, L6945), akārṣīt, V с i/ī (-īt), VI ayāsīt, VII «от корней на ś, ṣ и h»; аугмент как в impf.
aorist-types:63	AGREE	урок XLV (L6911)	Парадигма abhūt от «bhū возникать, становиться» (I корневой аорист); суплетивная связь с as не обсуждается.
future:23	AGREE	урок XLIV (L6757)	«посредством суфф. sya [ṣya]... принимающего окончания ind. praes.»; guṇa корня (L6759); kariṣyati, bhaviṣyati.
future:24	AGREE	урок XLIV (L6735)	«nominis actoris на tṛ» + формы as для 1–2 л.; «в третьем лице глагольная форма опускается»; bhavitā, kartā.
future:26	SILENT	—	Опис. будущее дано только формально (ур. XLIV); о значении «отдалённое/предначертанное» ничего — искал «отдал-», «неизбеж-».
future:28	AGREE	урок XLIV (L6841)	«Imperfectum, образованное от простого будущего, называеся conditionalis», в условных предложениях; adāsyat; контрфактика видна в упражнении (L7009).
ta-na-participles:19	AGREE	урок XXVII (L3593)	«Part. perf. pass. образуется посредством ta, f. ā, или na [ṇa], f. ā»; употребляется как прилагательное (L3651).
ta-na-participles:20	AGREE	урок XXVII (L3651)	«часто со значением глагола (verbi finiti), напр. sa gataḥ „он пошел“» — активное прош. значение от непереходного.
ta-na-participles:26	AGREE	урок XXVII (L3595)	«na обыкновенно присоединяется к глаголам на ṝ... на r и на простой d»: sanna, bhinna, bhagna, līna; -ta — общий случай.
ta-na-participles:28	AGREE	урок XXVIII (L3797)	«Конечные dh и bh превращаются в d и b, а следующий за ними t - в dh»: baddha, labdha; dagdha, gūḍha (L3805–3839).
ta-na-participles:84	AGREE	урок XXVII (L3593)	«от корня, принимающего обыкновенно кратчайшую форму».
present-perfect-participles:19	AGREE	урок XXVII (L3591)	По сути: причастия склоняются с ж.р. ā/ī и рубрицируются по времени и залогу — «Part. praes. Ātm. ... посредством māna..., f ā».
present-perfect-participles:102	AGREE	урок XXIII (L3047)	«Имена муж. р. на at в сильных пад. имеют ant»; ж.р. на ī = -antī/-atī по классам (L3068, L3072); согласное склонение.
present-perfect-participles:103	AGREE	урок XXVII (L3591), урок XXXV (L5013)	«посредством māna» для I, IV, VI, X; «классов II, III, V, VII, VIII, IX... при помощи суф. āna» (sunvāna).
present-perfect-participles:104	AGREE	урок XXVII (L3591)	«причастие страдательного залога образуется посредством māna... kriyamāṇa» — от пассивной основы наст. вр.
present-perfect-participles:105	AGREE	урок XXV (L3275), урок XLIII (L6723)	«в сильных падежах основу на vāṃs... в слабых... на uṣ», vidvān/viduṣ; «Part. perf. Ātm. ... посредством āna» (dadhāna, cakrāṇa).
present-perfect-participles:107	SILENT	—	Семантического теста (одновременность vs состояние) нет — искал «одновремен-», пояснения к значению причастий отсутствуют.
gerundive:19	AGREE	урок XXX (L4257)	«Part. fut. pass.» на tavya/anīya/ya, все f. ā; «если должна быть выражена необходимость» (L4263); агенс в Instr. — общее правило пассива (ур. X, L1327).
gerundive:93	AGREE	урок XXX (L4257)	«Part. fut. pass. образуется посредством tavya (f ā), anīya... и ya» — ровно три суффикса и тот же термин.
gerundive:94	AGREE	урок XXX (L4263)	«Конечные i и ī изменяются в guṇa, а ṛ и ṝ в vṛddhi, напр. ji -- jeya; kṛ - kārya».
gerundive:95	AGREE	урок XXX (L4259)	«Перед tavya с корнями происходят те же изменения... как в инфинитиве, напр. vaktavya, labdhavya».
gerundive:96	SILENT	—	Правила для anīya даны (L4261), но анализа -ana (имя действия) + -īya нет; искал «anīya», «имя действия».
gerundive:97	AGREE	урок XXX (L4257)	Все три объединены одним «Part. fut. pass. образуется посредством tavya, anīya и ya» = одна функция; стилистика/метрика выбора не обсуждаются.
infinitive:19	AGREE	урок XXX (L4123)	«Infinitivus образуется посредством суффикса tum», guṇa; соед. i (bhavitum, L4249); śak+inf. (сноска L11871), цель в упражнениях; про вин.п. на -tu ничего.
infinitive:95	AGREE	урок XXX (L4259)	«Перед tavya... те же изменения... как в инфинитиве»; тождество с -ta прямо не сформулировано (лишь -tvā ~ ta/na, L3989).
infinitive:98	SILENT	—	Ведийских инфинитивов и истории формы нет — искал «tave», «dhyai», «ведийск-»; курс даёт только классический -tum.
absolutive:19	AGREE	урок XXIX (L4033)	«переводить... „когда, после того как“» — предшествующее действие; несклоняемость и односубъектность явно не оговорены.
absolutive:25	AGREE	урок XXIX (L3987, L4011)	«К простым корням tvā»; с приставками «посредством ya или, если корень оканчивается на краткий гласный, посредством tya»; praṇamya (L4019).
absolutive:82	AGREE	урок XXIX (L3989)	«корень принимает кратчайшую (слабейшую) форму»: gatvā, bhūtvā, uktvā.
absolutive:84	AGREE	урок XXIX (L4027)	«Очень редкая форма abs. образуется при помощи am» (smāram, bhojam); ведийская атрибуция не даётся.
absolutive:107	SILENT	—	Корпусные проценты DCS вне источника; у Бюлера нет статистики -tvā/-ya (искал подсчёты, «%»).
passive:19	AGREE	урок X (L1301)	«при помощи суффикса ya... принимает личные окончания Ātm.»; ucyate (L1325), kriyate (L1311); слабые формы корня; акцент не обсуждается.
passive:26	SILENT	—	IV кл. на ya (L652) и пассив (L1301) даны порознь; формальное совпадение основ и различие по акценту не обсуждаются.
passive:106	AGREE	урок XLVII (L7195)	«страд. залога образуются посредством окончаний Ā» (перфект, futura, cond., prec.); часть про DCS-теги — вне источника.
causative:14	AGREE	урок XVIII (L2300)	«Causativus... посредством суффикса paya или aya», подъём гласных guṇa/vṛddhi (L2306–2320); значение: «dāpayati он заставляет давать».
causative:113	AGREE	урок XVIII (L2320)	«kṛ, kārayati», «budh, bodhayati» (L2312), «gam, gamayati» — исключение без удлинения (L2308); darś caus. показывать (L2360).
causative:114	AGREE	урок XVIII (L2302)	«paya присоединяется к большинству корней на ā и двугласные»: jñāpayati, dāpayati; sthāpayati (L7003) — тот же вставной -p-.
causative:115	AGREE	урок XVIII (L2300)	«спрягается точно так как глаголы Х кл.»; неоднозначность обратного разбора -aya- не обсуждается.
causative:151	AGREE	урок XLVIII (L7371)	Отдельный раздел «Denominativa, отыменные формы»: «образуются посредством ya, aya, āpaya» — laghayati, muṇḍayati.
causative:32	AGREE	урок XXVII (L3591)	«Part. praes. Ātm. классов I, IV, VI и X и каузативов» + Ā-формы каузативов в precat. (L6855) — оба залога.
word-structure-overview:25	SILENT	—	Модели корень→основа→словоформа и четвёрки способов (kṛt/taddhita/samāsa) нет; искал «kṛt», «taddhita», «деривац-».
word-structure-overview:30	SILENT	—	Утверждение о тексте Уитни; Бюлер Уитни нигде не цитирует (grep «Уитни/Whitney» — 0 попаданий).
word-structure-overview:83	SILENT	—	Статистики инвентаря корней нет — искал «%», подсчёты по классам; классы даны без количеств.
word-structure-overview:28	SILENT	—	Категории kṛt/первичной деривации нет; формы даются по урокам без деривационной рамки (искал «kṛt», «первичн-»).
krt-overview:19	SILENT	—	Термина kṛt и рамки первичной деривации нет (искал «kṛt», «деривац-»); отдельные формы есть, категории — нет.
krt-overview:34	SILENT	—	Ссылка на инвентарь у Уитни 1889; Бюлер Уитни не цитирует (grep — 0).
krt-overview:61	AGREE	урок XXIX (L3985, L4011)	«Absolutivum или Gerundium» на tvā и «Absolutivum на уа»; плюс редкий -am (L4027).
krt-overview:62	AGREE	урок XXX (L4257)	«Part. fut. pass. образуется посредством tavya..., anīya... и ya».
krt-overview:63	AGREE	урок XXX (L4123)	«Infinitivus образуется посредством суффикса tum».
krt-overview:67	SILENT	—	Утверждение о тегах разметки DCS; сами -ta/-na как прич. прош. страд. у Бюлера есть (ур. XXVII), но о корпусной разметке он молчит.
krt-suffixes:14	SILENT	—	Утверждение о §§ Уитни; Бюлер Уитни не цитирует и инвентаря kṛt-суффиксов не даёт.
krt-suffixes:96	SILENT	—	Различение посессивного -in/-vin и агентивного kṛt -in не обсуждается; -in-слова только в словарных списках (tapasvin, prakāśin).
