key	verdict	locus	note
a-stems:14	AGREE	раздел «Склонение» (L176–224)	Таблица: строки «N, Voc, A, I, D, Abl, G, L» × sg/pl/du (24 клетки), столбец a; «самое частотное» Z. явно не утверждает.
a-stems:17	SILENT	—	Voc в таблице — одна из 8 форм, но статус «падеж vs форма» и терминологию статьи не обсуждает (искал: Voc/зват., падеж).
a-stems:169	AGREE	раздел «Склонение» (L239)	Имплицитно: «подобно обычным прилагательным, в m и n по а‑склонению» — a-основы поданы как обычный тип; «крупнейший» не квантифицирован.
a-stems:172	AGREE	раздел «Словообразование» (L421)	«от основ на а --- замена ‑а‑ на ‑ā‑ или ‑ī‑» (жен. род прилагательных); m/n по a-, f по ā/ī; счёт 72 клеток — арифметика статьи.
a-stems:179	AGREE	раздел «Склонение» (L204–216)	Синкретизм в самих строках таблицы: «I D Abl ‑bhyām», «G L ‑os», «D Abl ‑bhyas» (a-осн.: ābhyām, ayos, ebhyas).
a-stems:202	AGREE	раздел «Особенности ведийского языка» (L507, L513)	«NVocpl m а-склонения -āsas вместо -ās», «Ipl m-n... -ebhis вместо -ais» — оба варианта есть.
declension-overview:20	AGREE	раздел «Склонение» (L176–224)	Та же сетка: «N, Voc, A, I, D, Abl, G, L» × sg/pl/du, отдельные строки для m/f и n.
declension-overview:22	AGREE	раздел «Склонение» (L177)	«Основообразующий элемент + окончание (особые случаи)»: столбцы a, ā, i, u, ar, an — распределение по исходу основы.
declension-overview:86	AGREE	раздел «Склонение» (L188)	Строка I sg: «E‑N‑A», «A‑Y‑ā», «i‑N‑ā», «u‑N‑ā», «r‑ā», чистое «‑ā» у согласных; ī/ū жен.: «стандартно: уā, vā» (сноска).
consonant-stems:19	SILENT	—	Ранжирования типов склонения по важности нет (искал: согласные основы, корневое склонение, «второй»).
consonant-stems:22	AGREE	раздел «Склонение» (L204–212)	an-осн. перед согл. окончаниями: «a‑bhis», «a‑su» (rāja-); Voc sg «an» (rājan) у Z. помечен «+» (guṇa), термина «средняя» нет.
consonant-stems:23	AGREE	раздел «Склонение» (L182–210)	Столбец an: N «Ā», A «ān‑am», I «n‑ā», Lpl «a‑su» — rājā, rājānam, rājñā, rājasu; то же трёхступенчатое распределение.
consonant-stems:30	AGREE	раздел «Склонение» (L226)	«in --- Nsg m balī..., NVocAsg n bali, Ipl balibhis» — Nom на ‑ī и потеря ‑n налицо; -min/-vin отдельно не выделены.
consonant-stems:31	AGREE	раздел «Склонение» (L226)	«NVocApl n manāṁsi, havīṁṣi, cakṣūṁṣi»; слова на as, is, us по умолчанию ср. рода (L476).
consonant-stems:33	AGREE	раздел «Склонение» (L226, L253)	Корневое склонение есть: «ā (корнев.)... jās», «Склонение основ catur‑, ṣaṣ‑ --- корневое»; vāc в лексиконе; ‑añc не обсуждён.
consonant-stems:98	AGREE	раздел «Склонение» (L182–216)	По таблице: «+» у N/A sg, NVocA du, NVoc pl; слабые «n‑ā», «nām»; средние «a‑bhis», «a‑su»; у Z. «+» стоит и на Voc sg (guṇa).
pronouns:19	SILENT	—	Списки местоимений даны, тезиса о закрытом классе/непополняемости нет (искал: закрытый, класс, пополн-).
pronouns:22	AGREE	раздел «Склонение» (L233–243)	«aham, tvam... Abl mad, tvad», основы asm‑/yuṣm‑; отдельного 3 л. нет — «sa 'он, тот'» (tad) в его роли.
pronouns:25	AGREE	раздел «Склонение» (L243–247)	«sa 'он, тот'», eṣa/etad, «ayam 'он, этот'» (n idam), «asau (m, f), adas (n) 'тот'»; глосса etad у Z. — 'он, тот', не 'этот'.
pronouns:26	AGREE	раздел «Склонение» (L241)	«Ka‑ 'кто, какой' --- то же, но Nsg n kim ('что')» — м. по ya‑ (kaḥ), ср. kim.
pronouns:27	AGREE	раздел «Склонение» (L239)	«Образец: уа‑ 'который'»; «Nsg n yad».
pronouns:28	AGREE	раздел «Превербы», Частицы (L460)	«'‑нибудь, ‑то': CIT, SVIT, CANA, API» — неопределённые как вопросит. + частица; сами kaścit/kaścana не выписаны.
pronouns:29	AGREE	раздел «Склонение» (L239–241)	«Так же: anya‑...», «sarva‑... как ya‑, но Nsg n... ‑m» — местоимённое склонение по родам; para/sama в списке Z. отсутствуют.
pronouns:32	AGREE	раздел «Склонение» (L239)	«D yasmai, Abl yasmād, L yasmin... Gpl m‑n yeṣām» — те же особые окончания (‑smāt = ‑smād).
pronouns:90	AGREE	раздел «Склонение» (L233–243)	«D mahyam / me... G mama / me», «G asmākam»; «Nsg m sa..., f sā; все прочие формы --- с начальным t» → tasmai, teṣām и т.д.
thematic-present:14	AGREE	раздел «Классы презенса» (L307–331)	Все 10 классов; тематические: «1 g‑a‑ naya‑ti», «6 tuda‑ti», «4 kupya‑ti», «10 coraya‑ti» — состав I/IV/VI/X тот же, примеры иные.
thematic-present:129	AGREE	раздел «Классы презенса» (L312–314)	«1 g‑a‑» против «6 ø‑a‑» — guṇa vs слабая ступень; акцент и тождество без акцента конспект не отмечает.
thematic-present:134	AGREE	раздел «Перфект», Пассив (L389)	«Пассив... ø‑ya‑ (т.е. как в 4‑м классе презенса)» — формальное тождество утверждено прямо; про акцент Z. не говорит.
thematic-present:150	AGREE	раздел «Классы презенса» (L312–330)	«9 ø‑nā‑», «5 ø‑no‑», «8 g‑o‑», «7 ø с инфиксом ‑na‑», «3 удвоит. слог», «4 ø‑ya‑»; 1 и 6 различены ступенью корня.
thematic-present:92	AGREE	раздел «Классы презенса» (L325–328)	«10 g‑aya‑ coraya‑ti» — в столбце тематических; каузатив «v/g‑aya‑» отослан туда же; деноминатив «+ ‑aya‑» (L419).
thematic-present:94	SILENT	—	Утверждение о тексте Уитни, Z. его не цитирует; сам он тоже даёт многоклассные корни («KAR... 5, 8», «DĀ... 3»), но иные наборы.
thematic-present:186	SILENT	—	«AS быть 2» в списке корней есть, но второго as 'бросать' (IV) и пары омонимов нет (искал: AS, бросать, класс 4).
conjugation-overview:25	AGREE	раздел «Спряжение» (L269–333)	Таблицы: 1/2/3 л. × sg/pl/du, столбцы Act/Med; «в презенсе, футуруме... в имперфекте, ... аористе, оптативе» — все пять осей.
conjugation-overview:26	AGREE	раздел «Классы презенса» (L333)	«в презенсе, футуруме... в имперфекте, плюсквамперфекте [вед.], аористе» + разделы Аорист/Перфект/Футурум; ремарка о DCS — вне источника.
conjugation-overview:27	AGREE	раздел «Перфект» (L377–391)	Есть все: оптатив, императив (‑tu/‑dhi), «Инъюнктив», «Прекатив», «Кондиционалис»; конъюнктив — только ведийский (L527).
conjugation-overview:28	AGREE	раздел «Перфект», Пассив (L389)	Act./Med. во всех таблицах + «Пассив (только система презенса)... спрягается в Med.» — три залога.
imperfect:19	AGREE	раздел «Классы презенса» (L335)	«Имперфект: аугмент a‑ + основа презенса, окончания вторичные» — формула та же.
imperfect:21	SILENT	—	Семантику имперфекта (нарратив, продвижение сюжета) не обсуждает — только морфологию (искал: нарратив-, повеств-, прошедш-).
imperfect:76	AGREE	раздел «Морфонология» (L147)	«аугмент а‑... сливается с последующими... в ai, au, ār» (= вриддхи); «AS быть 2 (имперф. āsīt)» — ās из a+as.
imperfect:77	AGREE	раздел «Спряжение» (L270–294)	Вторичный столбец: «‑am, + [V]‑m», «‑s», «‑t», «‑va», «‑tam», «‑tām», «‑ma», «‑ta», «‑an» (‑s = ‑ḥ в паузе).
imperfect:78	AGREE	раздел «Классы презенса» (L335) и «Важнейшие корни» (L448)	«a‑kar‑av‑am 'я делал'» (кл. 8 karo‑), «BHŪ... 1», «BRŪ говорить 2 (bravīti)» — классы и основы совпадают.
imperative-optative:19	AGREE	раздел «Перфект» (L385–387)	Имп. и опт. — единственные полнопарадигменные; «Инъюнктив... Важнейшая функция: запрещение», прекатив «≈ оптатив», конъюнктива в эпосе нет.
imperative-optative:89	AGREE	раздел «Спряжение» (L270–287)	Императивный столбец: 2 sg «‑dhi, [V] ‑hi || ‑», 3 sg «‑tu», 2 pl «‑ta» на основе презенса; функции (приказ/просьба) не описаны.
imperative-optative:92	AGREE	раздел «Перфект», Оптатив (L377)	«+ yā / ī..., окончания вторичные»; bhavet = bhava+ī → e; нюанс: в Med. атематич. у Z. ‑ī‑ (chindīta), не yā.
imperative-optative:93	SILENT	—	Функций оптатива (предписание, правило шастры) нет — лишь глосса «пусть я буду» (искал: следует, предписан-, шастр-).
imperative-optative:57	SILENT	—	Форма 3 sg ‑tu в таблице есть, но функции (юссив) и astu не даны; глоссой 'пусть' Z. снабжает оптатив (искал: astu, пусть).
perfect:14	AGREE	раздел «Перфект» (L357, L391)	«Формула основы: удвоит. слог + корень»; «Описательный перфект (заменяет... в производных спряжениях...)... + ām в сочетании с āsa».
perfect:16	DISAGREE	раздел «Перфект» (L365)	Z. прямо: «У vid 'знать' перфект без удвоения: veda» — veda у него исключение из редупликации, а не её пример.
perfect:105	AGREE	раздел «Аорист» (L339) и «Перфект» (L357)	Перфект — «удвоит. слог + корень», без аугмента; аорист — «аугмент a‑ + основа аориста»; диагностика следует прямо.
perfect:100	AGREE	раздел «Аорист» (L345)	«3 sg act ajījanat... (обычно это аорист каузатива)» — аугмент + редупликация = аорист; avīvṛdhan/abhyapaptat не названы, DCS вне текста.
perfect:101	SILENT	—	Формы adadat нет; ред. аорист у Z. — ajījanat, adīdṛçat, аорист от dā не приведён (искал: adadat, DĀ, тип 3).
perfect:118	AGREE	раздел «Перфект» (L391)	«+ ām в сочетании с āsa или cakara (перфект от as 'быть' или kar 'делать')» — as и kṛ есть; bhū и доминирование as не отмечены.
perfect:124	AGREE	раздел «Перфект» (L391) и «Словообразование» (L413)	«заменяет простой перфект в производных спряжениях»; у каузатива прямо «перфект --- описательный»; класс у Z. шире (+ тяжёлые корни).
perfect:134	AGREE	раздел «Классы презенса» (L314)	«3 удвоит. слог + g / ø: dadā‑mi 'даю' / dad‑ati»; «BHAR... 1, 3», «HU... 3» — bibharti, juhoti того же класса.
aorist:19	AGREE	раздел «Аорист» (L339)	Третий претерит, самый многотипный; «Основные типы аориста (прочие крайне редки)» — но основных у Z. пять, семь не перечислены.
aorist:84	AGREE	раздел «Аорист» (L341–353)	Корневой, тематический, ред. «(обычно это аорист каузатива)», s‑ (ajaiṣīt), iṣ‑ («apāvīt»); sa‑/siṣ‑ покрыты лишь «прочие крайне редки».
aorist:108	AGREE	раздел «Аорист» (L343)	«Простой тематический --- строится как имперфект класса 6» — прямо; параллели ред. аориста с имперфектом III класса у Z. нет.
aorist-types:19	AGREE	раздел «Аорист» (L339)	«Основные типы аориста (прочие крайне редки)» — несколько параллельных типов (у имперфекта/перфекта по одному); основных пять, не семь.
aorist-types:61	SILENT	—	Классификация Уитни; З. даёт 5 осн. типов («прочие крайне редки»), два зовёт сигматическими, но бипартиции и типов sa/siṣ нет; Уитни не цитируется.
aorist-types:89	AGREE	раздел «Аорист» (L339–353)	«аугмент a‑ + основа аориста, окончания вторичные»; удвоенный — «обычно это аорист каузатива»; ī в 2–3 sg s‑аориста есть; sa/siṣ не описаны.
aorist-types:63	SILENT	—	Искал: суплетив, AS/BHŪ, abhūt — AS 'быть' и BHŪ 'становиться, быть' даны порознь (L448), суплетивность не обсуждается.
future:23	AGREE	раздел «Перфект» (L379)	Футурум: «g‑sya‑ (или ‑iṣya‑), окончания первичные --- dāsyati 'даст', bhaviṣyati» — guṇa + sya/iṣya + первичные окончания.
future:24	AGREE	раздел «Перфект» (L383)	Футурум 2: «имя деятеля на ‑tar‑ (в N) + связка as 'быть' (кроме 3‑го лица, где без связки)»; dātā — ср. bhavitā/kartā.
future:26	SILENT	—	Искал: значение футурума 2, «отдалённое», «неизбежное» — дана только форма (L383), семантика не охарактеризована.
future:28	AGREE	раздел «Перфект» (L381)	«Кондиционалис --- по форме это имперфект футурума: adāsyam 'я дал бы'» = аугмент + основа на ‑sya‑ + вторичные окончания (L333).
ta-na-participles:19	AGREE	раздел «Перфект» (L395)	«Претеритное причастие (обычно страдат. у переходных глаголов…): ø‑ta‑»; про склонение по ‑a/‑ā отдельно не сказано, основы на ‑a‑ подразумеваются.
ta-na-participles:20	AGREE	раздел «Перфект» (L395)	«действит. у непереходных» — ср. bhūta‑ 'бывший, ставший'; перифрастич. употребление прямо не описано (лишь «конструкция с пассивным причастием», L549).
ta-na-participles:26	AGREE	раздел «Перфект» (L395)	«у большинства корней на d (типа aniṭ) и открытых корней ряда R₂ … ø‑na‑»; chinna‑, pūrṇa‑; ‑ta — общий случай.
ta-na-participles:28	AGREE	раздел «Морфонология» (L135–137)	«bh, dh, gh + t(h) → соответственно bdh, ddh, gdh»; «h₂ + t(h) → ḍh» с u→ū (ср. rūḍha); даны как общие внутренние сандхи, не только при ‑ta.
ta-na-participles:84	AGREE	раздел «Перфект» (L395)	«ø‑ta‑ (или ‑ita‑)», где ø — «корень в слабой ступени» (L66); ср. bhūta‑, chinna‑.
present-perfect-participles:19	SILENT	—	Искал: определение причастия, залог/время, именная форма — общего определения нет, даны только конкретные формы и их склонение.
present-perfect-participles:102	AGREE	раздел «Спряжение» (L298–301)	«‑ant‑ (‑at‑*)», f «‑atī || ‑ntī» (= ‑antī/‑atī); склонение по согласным основам — pacan/pacantam/pacatā/pacadbhis (L228, «Склонение»).
present-perfect-participles:103	AGREE	раздел «Спряжение» (L298)	«‑āna‑ || ‑māna‑» — после || вариант тематического спряжения (L267): ‑māna темат., ‑āna атемат.
present-perfect-participles:104	AGREE	раздел «Перфект» (L389)	«Пассив (только система презенса): ø‑ya‑ …; спрягается в Med.» + мед. прич. «‑āna‑ || ‑māna‑» (L298); сама форма kriyamāṇa не приведена, следует из правил.
present-perfect-participles:105	AGREE	раздел «Спряжение» (L298; тж. L229)	«‑vaṁs‑», f «‑uṣī‑»; «vidvān … vidvāṁsam … viduṣā (‑uṣ‑)» (L229, «Склонение»); медий перфекта — атематическое «‑āna‑».
present-perfect-participles:107	SILENT	—	Искал: одновременность, состояние по совершённому действию — семантика причастий не обсуждается.
gerundive:19	AGREE	раздел «Перфект» (L401)	«dātavya‑ и deya‑ 'подлежащий отдаче'», «который нужно расколоть» — необходимость + пассивность; агент в I. и склонение по ‑a не оговорены.
gerundive:93	AGREE	раздел «Перфект» (L401)	«g‑tavya‑ (или ‑itavya‑), g‑anīya‑, v/g‑ya‑» — те же три суффикса; термин у З. «герундивы», не future passive participle.
gerundive:94	AGREE	раздел «Перфект» (L401)	«v/g‑ya‑» (guṇa или vṛddhi по типу корня); примеры kārya‑, deya‑ — ср. kṛ→kārya, ji→jeya.
gerundive:95	AGREE	раздел «Перфект» (L393, 401)	Формулы тождественны: «g‑tavya‑ (или ‑itavya‑)» и «g‑tum (или ‑itum)»; kartavya‑ есть; тождество основ следует из формул, прямо не сформулировано.
gerundive:96	SILENT	—	Суффикс «g‑anīya‑» и karaṇīya‑ есть (L401), но деривация через имя действия на ‑ana + ‑īya не обсуждается; искал: ‑ana, ‑īya.
gerundive:97	AGREE	раздел «Перфект» (L401)	Одинаковые глоссы: «dātavya‑ и deya‑ 'подлежащий отдаче'», «kārya‑ и kṛtya‑ 'который предстоит сделать'»; стилистич./метрич. выбор не обсуждается.
infinitive:19	AGREE	раздел «Перфект» (L393)	«Инфинитив: g‑tum (или ‑itum) --- dātum, chettum, bhavitum. (В ведах есть и другие.)»; падежное происхождение и модальное управление не даны.
infinitive:95	DISAGREE	раздел «Перфект» (L393–395)	С ‑tavya основа та же (g‑tum / g‑tavya‑), но причастие — слабая ступень: «ø‑ta‑» против «g‑tum»; ср. bhavitum/bhūta‑, chettum/chinna‑.
infinitive:98	SILENT	—	Искал: ‑tave, ‑dhyai, ‑toḥ, падежные формы — лишь «(В ведах есть и другие.)» (L393) и вед. «типы инфинитива» как свободные варианты (L491).
absolutive:19	AGREE	раздел «Перфект» (L399)	«Деепричастие: … bhūtvā 'будучи', … vi‑jitya 'завоевав'» — термин и глоссы передают несклоняемость и предшествование при одном субъекте.
absolutive:25	AGREE	раздел «Перфект» (L399)	«у глаголов без преверба ø‑tvā (или ‑itvā), с превербом ø‑ya (после краткой гласной ‑tya)».
absolutive:82	AGREE	раздел «Перфект» (L399)	«ø‑tvā», где ø — слабая ступень (L66): bhūtvā, uktvā, chittvā — ср. kṛtvā, gatvā.
absolutive:84	SILENT	—	Искал: ‑am, ведийский абсолютив, деепричастие — только ‑tvā/‑ya/‑tya (L399), тип на ‑am не упомянут.
absolutive:107	SILENT	—	Корпусная статистика DCS (523/1289) — вне конспекта; у З. лишь само правило распределения tvā/ya (L399).
passive:19	AGREE	раздел «Перфект» (L389)	«Пассив (только система презенса): ø‑ya‑ …; спрягается в Med. --- … ucyate 'говорится'»; акцент не обозначается; рубрики «вторичное спряжение» нет.
passive:26	AGREE	раздел «Перфект» (L389)	«ø‑ya‑ (т.е. как в 4‑м классе презенса)» — формальное совпадение с классом IV утверждено прямо; различение по акценту не обсуждается.
passive:106	AGREE	раздел «Перфект» (L389)	«Пассив (только система презенса)» — вне ‑ya‑ особой пассивной формы нет; DCS-тег вне конспекта; отдельно вед. пассивный аорист 3 sg на ‑i (L523).
causative:14	AGREE	раздел «Словообразование» (L413)	«Каузатив: v/g‑aya‑ --- bodhayati 'будит', kārayati 'заставляет делать'» — в «производных спряжениях», усиление v/g + ‑aya‑, значение понуждения.
causative:113	AGREE	раздел «Словообразование» (L413)	«bodhayati 'будит', kārayati 'заставляет делать'»; darśaya/gamaya не приводятся; gamaya без усиления формулой v/g не покрыт (ср. «и некоторые др.»).
causative:114	AGREE	раздел «Словообразование» (L413)	«После корней на ā вставляется p, напр. sthāpayati от sthā» — у З. класс корней на ā, а не «долгий гласный» вообще.
causative:115	AGREE	раздел «Классы презенса» (L325–328)	«10 g‑aya‑ --- coraya‑ti» с отсылкой к «Каузативам» в производных спряжениях — совпадение признано; неоднозначность обратного разбора не эксплицирована.
causative:151	AGREE	раздел «Словообразование» (L419)	«Деноминатив: именная основа (минус ‑a‑) + ‑aya‑ --- mṛgayate» — отдельная рубрика, не класс 10.
causative:32	SILENT	—	Искал: залог/Med. при каузативе — не оговорено; примеры активные (bodhayati), упомянут лишь пассив bodhyate (L413).
